"RSUP Dr. Cipto Mangunkusumo","Jl. Diponegoro No.71, Salemba, Jakarta","-6.2106","106.8451","4.3","193"
"RSUP Dr. Kariadi","Jl. Dr. Sutomo No.16, Semarang, Jawa Tengah","-6.9932","110.423","4.5","287"
"RSUP Dr. Sardjito","Jl. Kesehatan No.1, Sleman, Yogyakarta","-7.7687","110.3722","4.2","484"
"RSUP Dr. Sardjito","Jl. Kesehatan No.1, Sekip, Yogyakarta, DI Yogyakarta","-7.7687","110.3722","4.9","163"
"RSUP Sanglah","Jl. Diponegoro, Denpasar, Bali","-8.6786","115.2193","4.6","334"
"RSUD Kota Malang","Jl. Rajasa No.27, Bumiayu, Kedungkandang, Malang","-7.9845","112.6489","4.2","187"
"RSUD Dr. Saiful Anwar","Jl. Jaksa Agung Suprapto No.2, Klojen, Malang","-7.9758","112.6298","4.5","523"
"RS Brimedika Malang","Jl. Mayjend Panjaitan No.176, Klojen, Malang","-7.9689","112.6275","4.3","142"
"RS Dr. Soepraoen","Jl. S. Supriadi No.22, Sukun, Malang","-7.9823","112.6154","4.4","298"
"RS Hermina Tangkubanprahu","Jl. Tangkuban Perahu No.31, Klojen, Malang","-7.9712","112.6287","4.3","216"
"RS Islam Aisyiyah Malang","Jl. Sulawesi No.16, Klojen, Malang","-7.9734","112.6321","4.2","189"
"RS Islam Unisma","Jl. Mayjen Haryono No.139, Lowokwaru, Malang","-7.9612","112.6178","4.1","163"
"RS Lavalette Malang","Jl. W.R. Supratman No.10, Klojen, Malang","-7.9745","112.6312","4.4","287"
"RS Panti Nirmala","Jl. Kebalen Wetan No.2, Kedungkandang, Malang","-7.9876","112.6445","4.2","174"
"RS Panti Waluya Sawahan","Jl. Nusakambangan No.56, Klojen, Malang","-7.9721","112.6334","4.3","203"
"RS Permata Bunda","Jl. Soekarno Hatta No.75, Lowokwaru, Malang","-7.9589","112.6234","4.0","156"
"RS Persada Malang","Jl. Raden Panji Suroso No.4, Blimbing, Malang","-7.9623","112.6412","4.3","245"
"RS Universitas Brawijaya","Jl. Soekarno Hatta No.22, Lowokwaru, Malang","-7.9567","112.6189","4.2","198"
"RSIA Galeri Candra","Jl. Andong No.3, Lowokwaru, Malang","-7.9578","112.6201","4.1","134"
"RSIA Mardi Waloeja","Jl. Kauman No.23, Klojen, Malang","-7.9698","112.6295","4.2","167"
"RSIA Mardi Waloeja Rampal","Jl. W.R. Supratman No.1, Klojen, Malang","-7.9743","112.6318","4.3","179"
"RSIA Melati Husada","Jl. Kawi No.32, Klojen, Malang","-7.9667","112.6289","4.0","145"
"RSIA Muhammadiyah Malang","Jl. Kyai H. Wahid Hasyim No.30, Klojen, Malang","-7.9705","112.6283","4.1","152"
"RSIA Mutiara Bunda Malang","Jl. Ciujung No.19, Blimbing, Malang","-7.9634","112.6398","4.2","168"
"RSIA Permata Hati","Jl. Danau Toba No.17, Kedungkandang, Malang","-7.9812","112.6467","4.0","132"
"RSIA Puri Bunda","Jl. Simpang Sulfat Utara No.60, Blimbing, Malang","-7.9645","112.6387","4.1","159"
"RSIA Puri Malang","Jl. Taman Slamet No.20, Klojen, Malang","-7.9672","112.6276","4.2","173"
"RSIA Refa Husada","Jl. Mayjen Sungkono No.9, Kedungkandang, Malang","-7.9798","112.6523","4.0","141"
"RSIA Rumkitbab Malang","Jl. Panglima Sudirman No.20, Blimbing, Malang","-7.9656","112.6356","4.1","186"